vignettes/data/WS123456_12345678a_PierreBEZUKHOV.csv

gene,score
gene1,97.69551407080144
gene2,11.268735490739346
gene3,98.85932896286249
gene4,64.01149020530283
gene5,3.4885045839473605
gene6,11.364244297146797
gene7,86.75479979719967
gene8,13.826998881995678
gene9,49.70640663523227
gene10,10.610401607118547

articles/reading-files.md

#> # A tibble: 10 × 2

#>    gene   score
    #>    <chr>  <dbl>
    #>  1 gene1  97.7 
    #>  2 gene2  11.3 
    #>  3 gene3  98.9 
    #>  4 gene4  64.0 
    #>  5 gene5   3.49
    #>  6 gene6  11.4 
    #>  7 gene7  86.8 
    #>  8 gene8  13.8 
    #>  9 gene9  49.7 
    #> 10 gene10 10.6